College,Comment
University of Minnesota,"I only use rideshare when I go out to concerts or the airport. If rates have to go up slightly to cover fair wages, then so be it. That said, there should be some transparency involved in this process and overseen by the state of Minnesota so that companies don’t flat out gouge customers under the guise of “uNfAiR rEgUlaTioNs”"
University of Minnesota,Whiny corpo bitches. This is the exact same bullshit that companies say to push back against minimum wage increases. Fuck em. If they can't afford to pay the workers a living wage (the same workers that make their business possible) then I look forward to the return of taxi companies.
University of Minnesota,"That's so much bullshit... They aren't gunna leave.

All the greedy companies need to be taught that there is an honest person ready to start a business as soon as the greedy competitor is out of the way.go ahead... leave..."
University of Minnesota,Lyft is usually twice as expensive as Uber right now anyway... They have bigger issues than this they need to resolve first just to keep their current market.
University of Minnesota,"Saying this as a non-driver who relies heavily on Lyft here: Lyft can eat it. I got this same type of email when they were pushing Prop 22 in San Francisco and I’m still furious that that passed. They weren’t ever going to leave San Francisco, much less CA as a whole (which they were literally threatening—like, come on), and they quite likely won’t leave here either. If they do, there will be other options."
University of Minnesota,God I hate corporate propaganda.
University of Minnesota,"good, fuck lyft and uber those vultures  
  
tip your drivers"
University of Minnesota,"""Dear Lyft

I am a cabbie. I hope you leave"""
University of Minnesota,"""They'd earn less due to fewer ride requests"" 

As opposed to dog shit rides worth 4$? Lol?"
University of Minnesota,What a bunch of fear mongering and bullshit
University of Minnesota,"What a bunch of bullshit bullying tactics…

There is NO fucking way Uber or Lyft are going to take their services out of the 16th largest metro in the fucking country.

Boo-fucking-hoo! Pay your fucking drivers!"
University of Minnesota,Aaaaand deleted *that* account.
University of Minnesota,Is this the issue with the wage increase for their employees or something else?
University of Minnesota,Uber sent me the same email word-for-word
University of Minnesota,"We only have 4.67 billion dollars!!! You’ll have to pay the drivers more because we just couldn’t possibly pay our drivers a livable wage, we’re too poor!!!"
University of Minnesota,The pay isn’t the biggest problem. They can’t deactivate drivers who pose safety issues without five days written notice. Think about how dumb that is.
University of Minnesota,K bye
University of Minnesota,Okay
University of Minnesota,"I. Am. So. Afraid.

Any leverage for the little ones is seen as a threat."
University of Minnesota,they said the same threats to Seattle and guess what they never left Seattle after they passed similar laws
University of Minnesota,"Fuck em. There are smaller, some co-op based rideshare companies here who would greatly benefit from the duopoly collapsing under its own greed."
University of Minnesota,Oh I'm sure these companies making drivers operate at a net loss or best case less than minimum wage really care about the drivers 🙄
University of Minnesota,Ohhhhh noooooo! I totally hate riding my bike down awesome paths that pretty much get me to anywhere I want. Man I’m really going to miss getting into random peoples cars and paying a lot of money for nothing. Shucks.
University of Minnesota,"So will they stop operating or double their prices? Do they just expect us to also believe that higher wages is both unsafe and costly? Costly I understand for riders Why is it unsafe for anyone?

Edit: I see the bit about allowing drivers to continue, but I have no idea what Lyft does now other than using its ratings to prioritize. Not sure that is a real safety check"
University of Minnesota,Call their bluff. If paying their drivers minimum wage is too burdensome so be it.
University of Minnesota,"Fuck lyft

dumbass corporation bitching about having to follow some rules. I wish they would GTFO out of my city, but my dumbass city council have no principles or spine to do anything."
University of Minnesota,"Lyft is starting to sound like Purdue Pharma.

#Greed"
University of Minnesota,Words.
University of Minnesota,Fuck 'em.
University of Minnesota,Fuck em
University of Minnesota,Time to call a taxi service!
University of Minnesota,"Things at risk in Minneapolis:

1. Lyft
2. Personal Protection
3. your safety
4. parental rights
5. Tax dollars
6. cash apps
7. sobriety
8. Healthcare
9. Liberty 
10. Freedom to be Christian 
11. Education free from indoctrination 
12. Sky High Rent
13. Sky high Tuition 
14. Most importantly your vote from being overwhelmed by illegals w MN ID's"
University of Minnesota,"""If we pay people a living wage they won't be able to work as much!"", says the multi billion dollar international corporation. 


Kiss my ass. They're not going to give up a market of 3 million or so people because they make slightly less money in it. We're easily the most profitable market in our state each state that touches ours."
University of Minnesota,If they're still making money here they will stay.
University of Minnesota,"Hmm...this makes me feel like their local lobbying might not be as effective. There is no justifiable reason why the company can't keep operating affordably even if they have to pay their drivers more. On a side note, I read somewhere today that despite inflation and a decline in profits, Medtronic's CEO pay ratio to their median worker **increased** from 215:1 to 230:1.

Feel free to raise your prices or do whatever you want Lyft, but understand that a possible consequence is that the market won't react favorably. What you won't do is feign concern about the well-being of the drivers and costs to the customers when we know that all you care about is your profit. 

I'll be telling the City Council to vote ""Yes"". My deepest sympathy to your shareholders and investors."
University of Minnesota,CALL. THEIR. BLUFF.
University of Minnesota,Does anyone have a link to the full ordinance that’ll be voted on?
University of Minnesota,okay bye
University of Minnesota,**Bye**
University of Minnesota,"This sound slike anti union jargon. 

Vote yes"
University of Minnesota,"While typically I would agree market openings lead way to better competitors, we’ve already seen the alternatives so far from traditional taxi companies. Apps like iHail, zTrip, and Ridesure are out there and they all suck across the board from inconsistent payments, bad updating of location, and terrible interfaces.

Given the cost of becoming a licensed ride share company in the city (btw none of those apps are) it’s a huge uphill battle for new entrants."
University of Minnesota,"Politely, you really have no idea what you are talking about. From both a basic economics standpoint and the basics of running a business basically everything you wrote is nonsense.

Any new entity that tried to replace Uber/Lyft in just the metro would likely need to make significantly more operating profit just to be able to cover their fixed costs and stay in business. And they would have a much smaller customer base to do it with. And to be clear, we're not talking about the whole Twin Cities, it's just Minneapolis and St. Paul, so you're really looking at a market of less than a million.

And that doesn't even begin to account for the fact that Uber/Lyft were able to build their infrastructure over a decade during a much lower interest rate environment and operated at significant losses for years. Apparently this new company just needs to be willing to make less money than companies than have famously lost billions of dollars before they even became profitable? 

And creating the app would probably be one of the easier parts of getting the business of the ground. Both dealing with the legal aspects and successfully recruiting a reliable driver base are going to be a much harder part of getting this sort of business started.  

And an extra $1 a ride would almost certainly not come close to meeting minimum salary demands of riders, let alone all the other costs associated."
University of Minnesota,You make software development seem so easy. It is not.
University of Minnesota,">Making the app is the hard part, but after that it's just maintenance. Keep it running well and you have a turnkey operation on your hands.

..."
University of Minnesota,"They pulled out of Austin, allowed a competitor to spring up, and then moved back in to kill it.

Their long term strategy is to stay in cities. Unless they collude with each other, the competitor will gladly move back in to claim a monopoly over a city."
University of Minnesota,"A fellow in Seattle just has a static website and gets calls. RidesbyDan or something. He advertised on Craigslist. 
The article I read says he is happier and makes more now."
University of Minnesota,"Meh. I always found it annoying to have to have $40 in cash on me just to convince a cabby to drive me 3 miles home. If I could find one to begin with. 

There’s a reason people stopped using cabs"
University of Minnesota,"No one:

Op: just create a new ride hailing service without economies of scale"
University of Minnesota,"I can't tell if this is a horrible sarcastic post or an OP seriously out of touch with reality, but I know this is truly a case of ""if this was so damn simple it'd been done""

> The second, is to be willing to make less money than Lyft and Uber do per ride. Making the app is the hard part, but after that it's just maintenance. Keep it running well and you have a turnkey operation on your hands. You do not need to make that much money per ride to be successful, you just need to make some money. Even if it's only a dollar a ride, there is around 4 million people in the Twin Cities. That dollar would add up very quickly.

https://www.reuters.com/technology/uber-posts-first-small-adjusted-profit-ridership-rises-delivery-gets-more-2021-11-04/

Please feel free to read. Look at when that article was made. Look at how much they lost. Think about how long you've known of the term ""Uber"", and how only two years ago did they finally make money. 

For this to have stemmed with looking out for driver's pay and ending with ""oh, don't worry about yourself making money"" is comical"
University of Minnesota,OP gone full send on the open marketplace mythology. Just because there’s a vacuum doesn’t mean that what replaces it is an improvement to anyone.
University of Minnesota,They're not going to leave.  They're threatening to leave like they have with any other place that's tried to get the people working for them to get more money
University of Minnesota,"In addition to all of the other reasons this will be terrible, I use Uber and Lyft all of the time to avoid a DUI, as well as avoid mistakenly killing someone.  If you go to a bar and have 2-3 drinks you are over the limit, and driving home can put you in jail, cost you your job, cost $10,000, etc.  This will also cause deaths due to people still wanting to go out, only having to drive themselves."
University of Minnesota,The lengths people go to in order to avoid investing in good public transportation infrastructure...
University of Minnesota,"Other competition already exists, and its terrible.  Uber and Lyft came in because cabs were overpriced, and inconvenient.  

Do I agree that Uber and Lyft drivers should make more?  Absolutely.  But, the only way they can make more is if Uber and Lyft CHARGE more.  Uber and Lyft are already basically the perfect example of capitalism, since the rides are priced based on the supply of drivers to the supply of riders.  Should that change?  Having never driven for Uber or Lyft I really am unqualified to say one way or the other.  But if it does, you'll pay that cost, Uber and Lyft certainly won't eat it."
University of Minnesota,App development and maintenance would be over 100 million probably. 
University of Minnesota,"Ride-sharing is unfortunately not a profitable venture… Uber’s whole plan was the corner the market so that when they had a fleet of self-driving cars, they could finally start cashing in without having to pay drivers. 

What we need is better public transportation that’s already paid for by our tax dollars so that we don’t have to spend $30 every time we want to go anywhere"
University of Minnesota,"This is funny because the process for building a competitor business that you just described was the process Uber and Lyft used...so you're just saying ""hey, somebody DIY recreate an enormous company real quick, what's the big deal?"" 

I don't support Uber or Lyft but this argument as you've voiced it is silly level of naive"
University of Minnesota,No I'd rather pay more than let them leave because I don't drive
University of Minnesota,Tell me you have never taken a taxi without telling me you have never taken a taxi.
University of Minnesota,Just take the light rail.  I have heard great things.
University of Minnesota,"If you believe in supply and demand, then why not let supply and demand play its course? The fact the government is getting involved is an unnatural and detrimental affect to supply and demand.

Leaving a hole in the market would work to bring in competition if there wasn't an artifical barrier to entry. It'd be like getting rid of all the coffee shops in the twin cities and saying, to sell coffee now you need to pay a fee that's untenable. Well, I *would have* opened up a coffee shop to fill the gap and take in all that revenue, but now there are government fees and restrictions that make it completely not worth doing.

I get the *idea* that people *would* make more money with a higher minimum wage, but that's no longer true if the job no longer exists. We're no longer helping these people make more money by getting rid of the jobs."
University of Minnesota,"I'm hoping those drivers go to work for Metro Transit instead.  Their biggest problem is finding staff, and a fully staffed agency would make rideshares mostly unnecessary.

For extenuating circumstances, there are still traditional taxi services that maintain their own vehicles and pay drivers as employees, the way Uber and Lyft should be doing anyway."
University of Minnesota,Have they ever actually followed through on these threats in the other places they've made them?
University of Minnesota,"I can’t wait to download a new rando, glitchy app to get from point a to b.

I’m not worried about it, I don’t think Uber or Lyft is going anywhere, it’s too valuable and will fuck up too much stuff if it goes away."
University of Minnesota,I miss car2go. :( They were forced out of the city as well.
University of Minnesota,This is a bluff.  They’ll simply introduce price floors and rides will cost more to consumers.
University of Minnesota,I was talking with one of my Lyft drivers and was relatively new to the country. He was renting a car from Lyft for $250 a week and didn’t realize he was going to be taxed out the ass on the money earned.
University of Minnesota,"You're just optimistic, lol. Do it yourself OP

>The second, is to be willing to make less money than Lyft and Uber do per ride.

...they aren't making money. This entire post is so dumb"
University of Minnesota,Cabs have always been fucked. So many times I have been left in the cold when they ask where we are going and when it’s not a good fare for them all of a sudden they are busy and drive off. Not to mention countless arguments about how the credit card machine does not work and how they only want cash. They were always awful and rude!!!
University of Minnesota,How about we let the market figure this out instead of the govt? Is anyone forcing people to drive for these companies?
University of Minnesota,"Not sure I agree with everything in OP's post, but it's true that a substantial reason for Uber/Lyft's success is that they 1) haven't ever had to make a profit, and 2) don't pay their workers fairly.

Uber and Lyft are a net detriment to the Twin Cities because they aren't regulated and they pull people off public transit. 

We should invest in more frequent, cleaner, better-staffed public transit and let taxi companies fill whatever demand exists for Uber and lyft."
University of Minnesota,I’d love for a group like Hourcar/Evie to come in and setup a cooperatively operated version of these services.
University of Minnesota,Wait my next door neighbors are immigrants and the husband is an Uber/lyft driver and he has a new baby. I’d hate for him to be suddenly out of work 😭😭 so many immigrants do ridesharing
University of Minnesota,Uber and Lyft would pull out because MN recognizing their workers as employees and not contractors would open up the flood gate of legal liability in other states (as MN would be a direct point of comparison). Their long-term wellbeing would depend on them pulling out. The company has been systemically losing cases for years now and is delaying the inevitable. Fuck Uber and Lyft and their soulless business practices. I hope MN calls their bluff and makes them pull
University of Minnesota,It happened exactly like this in Austin.
University of Minnesota,Sweet summer child. Just a software? The legal hurdles alone are just the tip of the iceberg.
University of Minnesota,Invest in better public transit.
University of Minnesota,Ride share apps exploit workers. Trains and busses are the way.
University of Minnesota,"And bus/light rail were like “Hi? We have been always here for you…?”   

All of this Uber/Lyft problem won’t be severe if urban planning priorities the city zoning around the bus and light rail routes… It is a time-tested and proven system since before Ancient Roman time. Single family housing zoning is a huge problem."
University of Minnesota,"Generally speaking, when a service disappears its usually gone for good. Uber and Lyft were only ever affordable at the beginning because they were being pumped with venture capital at ludicrously low interest rates. But once investors started demanding a return on their investment and interest rates went up these ride share companies needed to start making a profit. There are two major ways to make a profit (in the eyes of the capitalist); cut costs and increase prices. The fact that Uber/Lyft are pulling out of the market because ***minimum wage*** makes their business model unprofitable means their business model doesn't work, at least without operating at a loss. 

So if the business model failed, no one will come in to replace them because no one can make a profit off of the business model. If they did we would still have street car companies and milk men. Now there is a way for services to be preserved, and that is if we replace the investor with the tax payer. We *could* spin an uber/lyft style company off as an agency and use our collective pooled money to fund it. but we already have something like that, and the agency is called Metrotransit. 

I agree with you that the exit of Uber/Lyft could be a net positive, but not because better version of the ride share model will appear. But because some of the supply and demand will move to public transit options."
University of Minnesota,"This seems like a spot for a business like Empower to come in and thrive. I’m not totally advocating for it, and it has its issues, but it is cheaper, and riders typically make more as well."
University of Minnesota,Gig workers deserve protection
University of Minnesota,"Imagine if we had a company that actually had to EMPLOY rideshare drivers…. Maybe they would even be required to provide vehicles and check on licensure…. Oh, like ducking taxis used to do?!?! Yes, pass this shit! Uber and lift are criminal exploitation. Often of immigrants"
University of Minnesota,"Uber and Lyft leaving Minneapolis would cost me personally negatively affect me because that’s what I exclusively use for transportation. I will use any alternative that takes their place. 

I’m not talking Metro Transit, ever. And as a poor person receiving DAC, it would save lots of money, but I refuse to take it out of principle. So the car abolitionists that are advocating for this can kiss my ass."
University of Minnesota,"News flash, they won't fucking pull out anyways... They just want to bitch and moan so they can keep their margins."
University of Minnesota,"There will be a small interruption, then someone else will step in that will follow the rules.

Lyft and Uber have no ""special sauce"" anymore. When they left Austin years ago, well-running alternatives popped up within months.

Anyway, I find it hilarious how people turn into captain capitalist when it comes to defending uber and lyft in these threads."
University of Minnesota,Let them leave.  Fuck them and the crusted over bandaid they pretend to provide.
University of Minnesota,"Who is forcing the drivers to work for Uber or lyft? Are they not aware of the pay before the start driving? I haven't taken many rides with these companies, but when I have,it seemed like it was more of a second job. Or even a hobby for some of the drivers."
University of Minnesota,"I take Uber often. I love talking to drivers. So many incredible stories & journeys.
I always tip 50%. 
It is an unsustainable model….though when it’s needed it is very needed."
University of Minnesota,Their threats are empty.  I do not care as I never use them but it reminds me of pro sports owners whining for tax money or they will leave
University of Minnesota,They're not going anywhere.
University of Minnesota,"If the Uber and Lyft drivers are not making enough they should quit... That's the true market, if it's not paying enough stop doing it. Lyft and Uber would be required to pay more. That's how it's supposed to work."
University of Minnesota,"Yep, call the bluff. If they leave someone will fill their place (they won’t leave anyway)."
University of Minnesota,The app could easily be run by AI and the drivers should get the majority of the money.
University of Minnesota,"Exactly, something else will fill that void. I use a semi-local service for grocery delivery called Buncha (they’re also in Denver) and it’s almost the same as Instacart but set delivery days so much cheaper. 

I also have been using another local company—  Evie Car share /Hourcar instead of Uber/lyft for a while now, because it ends up being much cheaper. (I just pay for the $7 monthly membership which is actually drive credits and then cancel immediately after since I tend to not use it every month.) Obviously this doesn’t help people who don’t / can’t drive, but it’s just to say, Uber and Lyft aren’t that special. Sure it was special back when they created it but it’s not impossible to replicate."
University of Minnesota,"Pre-COVID, I thought that having ""slug lanes"" would have been beneficial to cut down traffic on 35W and 394. They're basically organized group hitchhiking common in the Northern Virginia suburbs of DC. [http://www.slug-lines.com/](http://www.slug-lines.com/)  Drivers pick up passengers at designated origin points in the suburbs, use the HOV lanes, then drop off at center points downtown. Do the reverse in the evening. No coordination required."
University of Minnesota,I use them both and see no difference.
University of Minnesota,"I try to use Lyft but Uber connects me with a driver much faster. Recently I’ve stopped trying Lyft because it won’t connect to a driver, especially from the airport."
University of Minnesota,"Lyft links to my Delta account as well as earning me more points through my credit card, but I still check both. If it’s within a couple bucks I’ll go Lyft."
University of Minnesota,"In my experience over the last year, they've gotten very close to each other. On average, Lyft is a little less expensive, and Uber slightly more reliable in terms of timing and finding drivers. I did have a very strange experience with Uber this summer where the driver somehow kept the ride going after dropping me off, resulting in a $200 ride for what was supposed to be $30, but Uber customer service fixed it right away."
University of Minnesota,Both. It’s a capitalist world. Check both then go with the lower price.
University of Minnesota,"It depends on the situation for me. There are situations where I can save some money and wait a little longer, and that is usually with Lyft about 90% of the time. Lyft drivers give me better ratings to compared to Uber drivers. However, I can usually get a ride pretty quick with Uber."
University of Minnesota,"I mainly use Lyft because someone stole my debit card info, used Uber, I then reported it, and they locked and banned my account

If that's any indication....I never had a bad experience until that shitshow of a response."
University of Minnesota,"I've had better luck with Lyft, specifically when I try to schedule rides ahead of time. Sometimes I want to schedule a ride ahead of time when I need a morning ride, and Uber's app constantly glitches out and says I'm unable to, despite it supposedly being a function available on the app. I never have had that problem with Lyft, so I use Lyft. I like the peace of mind knowing I won't forget. Never had any problem finding a driver either."
University of Minnesota,"I use whichever one is cheaper, though I will prefer Uber if I need to get moving quickly. Lyft tends to bounce me around from one driver to another (and not because they're canceling!) which is very, very annoying."
University of Minnesota,Whichever one's cheaper in that exact moment you need a ride
University of Minnesota,Uber
