College,Comment
ASU,"this is no different from every other $25 lyft coupon available, only you make money instead of my friends who have $25 codes. "
ASU,">Remember look for the cars with the pink mustaches. 

Actually drivers have been instructed not to put them on their vehicles since the mustaches make them targets for enforcement in Arizona. Uber > Lyft anyways"
ASU,Why is it every time I get a lyft they give me codes for free rides but these codes can only be used by someone who has never had a lyft? Obviously I won't be able to use it.
ASU,Lyft always been cheaper for me
ASU,"I'm not a huge fan of Uber as a business so I default to Lyft. If lyft is too expensive or gonna take too long, then I'll see what Uber can do, but it's rare they can do better."
ASU,"I have found Lyft to better for short distances, like within a 10-15 min drive and Uber for longer distances."
ASU,"I use both and use whoever is cheaper at the time. Surprisingly Uber has saved me a couple extra bucks compared to Lyft. 
For the airport though I still use the lightrail"
ASU,"If it's peak times and you need a ride to/from airport, neither. Call a real cab company like Yellow or Discount (or look for the airport line) and avoid the surge pricing. Taxi from airport to Tempe is about $15 and no surge premiums."
ASU,"LSA is pretty smack dab in the middle of campus so it depends on how far you want to walk/inconvenience your driver. Getting dropped off in the parking lot for First United Methodist Church on University is probably the easiest and it's a 5 minute walk to LSA. if you're coming from North/Northwest/West then I'd do that. 

If you're coming from South/Southeast/East then I would have them drop you off at ISTB/Campus bookstore. Which is about a 5 minute walk to LSA as well. Traffic can be balls on Orange St. however, especially during midday. Lots of cars and pedestrians.

Getting dropped off by WP Carey building on Lemon could also work. Bit longer walk and traffic will still be balls, but that's Tempe campus in a nutshell. 

Someone else will hopefully come in with a great tip."
ASU,"This is the Life Sciences wing A:

https://tours.asu.edu/tempe/life-sciences-center

Also install the MyASU app as it has a map and that can help you if you get lost"
ASU,Lyft and Uber will prompt you to select a drop off spot on campus. My advice is to just focus on getting on to campus and use google maps to walk to class.
ASU,The hero we need. **ASUMan**.
ASU,Congrats!
ASU,Congrats on your accomplishment.  Enjoy having your nights back.
ASU,Congrats bro. I’m happy for anyone that gets their degree and reaches for higher education. I couldn’t imagine driving Uber and going to school full time. I was lucky enough that I worked in hotels overnight so I just did all my homework while I “worked”. No better felling than going to school for the last time. Proud of you.
ASU,Congratulations on your hard work. On the road and in school. Hope ypu can work at Uber HQ and fix things you feel are not working right for drivers AND riders. 🎉🎊👍👨‍🎓👩‍🎓
ASU, Congrats. What did you study and how long
ASU,I’m proud of you!
ASU,Congratulations!
ASU,Pretty cool!
ASU,How did you even attend it full-time and get degree if you had to drive a lot to get the ASU for free?
ASU,Congratulations! Be proud of yourself! Such a great accomplishment! I’m hoping to go back to school soon as well!
ASU,Congratulations 🎈🎉🎊
ASU,Congratulations! I saw that the other day too. I thought it wouldn’t work because don’t they make you drive for them in order to keep it? Would make sense to me. How many hours were you driving with them to keep the tuition?
ASU,That actually gives me a reason to go ahead and do it. Thanks for posting this. Glad to hear it was challenging and you felt it was worth it. How long did it take?
ASU,Way to go 👏🏼👏🏼👏🏼!!!
ASU,Congratulations
ASU,That’s awesome! Congrats!!
ASU,"Congrats OP, I'm hoping to be graduated from ASU in a year and a half using the same tuition reward. Going for electrical engineering, transferred in a bunch of credits as well"
ASU,"Great job, congratulations. I took advantage of it as well, I have 1 semester and I’ll graduate with a software engineering degree. The total cost was almost $100K. I paid less than $500 for books and other miscellaneous. 

Drivers if you can take advantage of this program."
ASU,"Congrats! You should point out that Uber will cover the ASU bill for the driver OR an immediate family member. My wife has been working on turning her Registered Nurse (RN with an Associates Degree) into a Bachelors of Science in Nursing @ ASU online for almost two years now, and she’s only got one more semester to go! Never paid a penny in tuition, only books. It’s a good deal!"
ASU,Good thing your done now  because with how upfront pricing is now I can't imagine keeping a high acceptance and low cancelation rate to get the free college and still make enough to be profitable....congrats friend .
ASU,Happy Holidays Brother
ASU,Congrats! Agree that don’t fully rely on rideshare for living. Most ppl won’t make it.
ASU,Congrats!!
ASU,Congratulations. Don't forget the tax bill comes for the tuition.
ASU,Congrats!
ASU,Congratulations OP👏🏻👏🏻👏🏻
ASU,Man congrats! That's awesome!
ASU,What is your degree?
ASU,Just got 40 for 20 today
ASU,You got it right on time! Just about impossible to keep gold status now
ASU,Congratulations!
ASU,Congrats man.  That's way cool.
ASU,Sweet dude congrats! Now I don't know where your market is but get yourself to an ASU party! Definitely a fun bunch and legendary parties. Lol I only know this because a former coworker when there.
ASU,Wohaaaaa that is what I want to hear. Congratulations OP.
ASU,Congrats and good luck to you and your future endeavors.
ASU,Congratulations! It's nice to hear a success story with Uber's corporate name attached to it once in a while. I'm happy you recognized your own hard work here too though. Best of luck in the future.
ASU,"Can someone please explain, do. i ned to take all the courses? Can I take only those I want? Can I speed up the process of obtaining degree?"
ASU,Go Devils 😈
ASU,Congratulations 🍾🎉🎈🎊 🎁
ASU,[deleted]
ASU,Did the useless piece of paper increase your income?
ASU,"Free, ehhh…even with 2020 fare rates you could have probably driven less by cherry picking and paid for the school yourself. Congrats tho"
ASU,Well done!
ASU,Congratulations. 👍🏽
ASU,"Good for you, nice accomplishment!"
ASU,How many rides a week is that to maintain status?
ASU,"Don’t need college for a real job, just think about all these people that went to college and are paying back all that money with a low to mid level job… 😛 funny thing you can go into a trade job and make more then a teacher (example) that went to college.. that’s a real shame."
ASU,Congratulations 🍾 and thanks for the friendly reminder 👍✊
ASU,Context? What is ASU and what is the special deal they have with Uber?
ASU,How long did it take for you to achieve 3000 lifetime rides?
ASU,Congratulations 🎉🎉🎉🤍
ASU,"What if i failed in calculus, can i retake it. Or i have to pay for it."
ASU,I believe that Uber expanded the program to cover masters degrees on Jan 1st. I’d call ASU on Tuesday to confirm though.
ASU,Thought it had to be used for yourself or family? :D seems like you might need to start driving for uber yourself.
ASU,"So much wrong with this post but I’m not going to get into the ridiculousness of many of the details. I’ll just explain one thing to you that you need to understand. First off, it’s not a scholarship, it’s just free tuition that can be used by the driver or a driver’s immediate family. Just unbelievable that someone who is actually going to college has to be explained this. What you are asking is just not possible."
ASU,"Fiction. You can only gift ASU to siblings, spouses and children."
ASU,time to apply for student loans
ASU,I thought I declined a lot of rides. 20% AR? What kind of rides are you even fishing for?
ASU,I just completed my degree thanks to this program.  It was awesome.  You apply and Uber pays for everything except books.  I spent 2 years in this program.  Graduated May 8th with a BA in psychology.
ASU,"I'm doing this right now though I'm taking the summer off. Studying Software Engineering. Uber pays EVERYTHING except books. There's no catch, no 'gotcha!"" It's just they pay everything except books.

Well there is a catch, you do have to keep uber pro status the entire time. So if you're a driver who can't make money without cherry picking rides you will not be able to stay qualified. Other than that it's good."
ASU,You have to pay just to apply lol
ASU,"I'm midway through a degree. The experience is underwhelming...90% of the material is publicly available books and even YouTube playlists. They also have software that trains you in subjects like advanced math, statistics, even psychology....no teacher required! I'm commonly thinking ""Does anyone work at this campus? What do professors do all day?"" Apparently the campus has some labs that serve as classes as well...no professor required.

Anyway, you can try it if you want something to do when you're not working that's not watching TV and playing video games. My big concern is: will the degree be worth anything? Or will employers be like ""That's nice, now drive me to the airport LOL""?"
ASU,"Are you allowed to just take courses, without pursuing a degree. I suppose you can just do that, but would that be frowned upon? I am in highschool currently thats why I ask"
ASU,"Uber Eats only drivers get it at 1000 deliveries.

Uber drivers, with or without the delivery option, get it at 3000 trips.


They use two similar, but different, rewards programs."
ASU,"“In addition to earning points, you must maintain certain ratings to earn Gold, Platinum, and Diamond rewards. The requirements vary by region. Please check the Driver app for more information.”

As with just about everything uber, shit varies market to market.  Check the requirements in the app"
ASU,Had anyone ever get it?
ASU,"I've completed 33 credit hours at ASU online since I started in Fall of 2019.  I'm on track to graduate in December of 2021.  This has been a great opportunity to finally complete what I started 18 years ago.  

Only thing you really have to pay for out of pocket is books and getting your transcripts from previous schools, if applicable.   Uber paid the application fee.  They pay the tuition and fees after any grants you qualify for, hence the reason you have to fill out the FAFSA (Starbucks employees getting their ASU benefit have to do the same thing).  Even if you don't qualify for anything on FAFSA, they will still pay your tuition and fees.  

The programs available are at:   [https://asuonline.asu.edu/online-degree-programs/undergraduate/](https://asuonline.asu.edu/online-degree-programs/undergraduate/)"
ASU,Good for you to not get into student debt.
ASU,What deodorant you use?
ASU,Just hit my 3k rides looking to take advantage of this.  Are there any fees involved?  Books?  What sort of programs do they have?
ASU,Im on the grind to complete my 3000 trips. Im currently at 550 trips. I want to go for computer information system. I just hope they dont end this program before I get a chance.
ASU,3k rides minimum to take advantage of this?? Sounds amazing!
ASU,So you say Arizona State University or do you just say HPVU?
ASU,Are there any stipulations? I have a BA in media communications but I would love to go back to school and study something else on Uber’s tab. I’ve done 10k rides.
ASU,I really wish they would offer graduate programs online. I'd love to get a Masters degree for almost nothing.
ASU,Congrats! 🥳🥳🥳🥳
ASU,Yes but I don’t know any one who sponsor me
ASU,Was your mascot a broken condom?
ASU,Is applying for those grants very time consuming or difficult?
ASU, I qualify for the ASUniversity but I haven’t done enough deliveries. 😩
ASU,"Do UberEats deliveries count towards the 3,000 rides required or does it strictly have to be passengers?"
ASU,[deleted]
ASU,How many times have you been fucked on a house boat?
ASU,Did you write your dissertation on the collective work of Red Bull?
ASU,"OK dumb dumb, get your batchelors, then get your masters.  Perhaps then you will have the cerebral horse power to continue this conversation.  Right now, your just tio stupid to accept anything that I say.  Hey, Stupid people need live too; I get that.

Moving on, have a great weekend. 😊"
ASU,2200 more trips to go....ty for this thread! was really curious whether the grind was worth it or not. really seems like it is.
ASU,[deleted]
ASU,Do they cover just the first year or the completion of your degree in full following several years?
ASU,"Hope you see this, but do they ask for gpa or ACT scores when applying? I’m hoping to sign my mom up but she’s an immigrant with most of her past academic scores/gpa lost."
ASU,I’m at 2200 rides! I’m grinding to get to 3000🥹😮‍💨⬆️
ASU,I hope it is OK to reopen this discussion. I'm curious if you had any credits transfer from your previous education?
ASU,Do they help with HOUSING MOST IMPORTANT LIKE STUDIO OR 1br
ASU,question about the scholarship did you have 2 and did they update to cover the full amount? i signed up and enrolled in classes but the amount for the asu uber eats scholarship doesn’t cover the full amount. i have a ticket for final aid and spoke to my success coach but they didnt know much about it. i curious if this happened to you.
ASU,How long does it takes you to finish it?
ASU,"Hey, can you still pull out loans for books and expenses? Like you can get like 5k a semester (cash or check that goes into your bank account) is that a thing?"
ASU,Do you knoe if the progrem includes Master Programs?
UF,I’ve been here for 3 years now and never realized this was a thing so I wanted to share!
UF,The amount of money I've wasted...
UF,"When I first saw it in my email I 100% thought it was a phishing scam, didn’t realize till later it’s actually a thing"
UF,Damn I didn't know this. Thank you!
UF,[removed]
UF,This is a actually so great thank you!
UF,"So when in the proper zone, is it best to Lyft instead of snap? Snap instead of Lift?"
UF,"Its 50% off between those hours but they also give u some free rides! Every year I think I get 5 free rides, it’s so awesome. Sometimes tho it gets really busy and u have to take an uber or wait super long"
UF,"I’m shocked so many people don’t know about the UF Lyft pass. My friends constantly complain about how expensive Uber is and REFUSE to download Lyft even though I keep telling them about it! 

Anywhere on campus for like a dollar or two. It’s awesome!"
UF,How does it work? Do we need a code or something?
UF,"Just a warning to others - I tried to use this last Friday night around 10:30 and Lyft couldn't find a driver (tried twice over 40 mins, just ended up paying full price for an Uber before it got even later) so be sure to have a backup plan!!"
UF,How do I get this
UF,I have 15$ lyft passes for 5$ dm me
UF,"A really cool partnership between UF and Lyft! See below:

https://taps.ufl.edu/alternative-transportation/uf-safe-rides/"
UF,for abt a month or so lyft + UF gave me like 25% off all my rides that fell into this like “boundary circle” and it was very helpful considering i used to not go far. maybe they’re offering it again?
UF,Its the n-word pass when using Lyft.
UF,"Haven’t used Lyft but assuming it has similar safety measures to Uber, you should be able to share your location with family/friends and/or reach out to a safety line or 911 if needed. Plus their background checks are pretty stringent so far as I know. I’d just make sure to schedule the ride ahead of time if possible and be prepared for a pretty expensive fare since that’s prob going to be over $100+tip lol"
UF,Im also a girl at UF and I use EZ airport shuttle service coming back from JAX. It’s a shuttle service a lot of UF students use. I usually talk to this guy named terry in charge
UF,https://www.ezshuttle.net/ I have heard these people are good.
UF,Did you try seeing if there's any busses or anything?
UF,That’s an 1 1/2-2 hr ride from Jax to campus. Try red coach or some bus service
UF,"Me and my family used lyft fairly frequently around gainesville and often ran into the same couple of drivers. there were only two times i felt uncomfortable, but i wasn't alone both times and those were two drivers we'd never seen before."
UF,I didn’t know this! Thank you!
UF,Thanks for posting! Those times are super confusing. Can anyone explain them clearly?
UF,Are these Lyft safe rides free for those hours?
UF,If you already had one does it automatically reapply because I haven't gotten another email about it.
UF,"Obviously scooter and driving in a car are different than literally paying for Uber to get to and from class, and this post is a friendly PSA — but, just try out the bus if you don’t rely on it already. They’re fairly routine in their stops, they get you from point A to point B, you can read a book or watch TikTok while you’re on the move, and you don’t have to drive — and if your stop is a few blocks away from your destination you even get some exercise in. 

I definitely could have physically afforded to pay for Ubers to and from class and not been *completely* broke at UF (I’m a very recent grad) — but that’s just utterly wasted money if you live anywhere around campus in the usual student housing complexes. And, the vast majority of people (myself included) cannot even imagine justifying relying on ride share services to get to class regularly because of $$$. I’m surprised that’s a thing. Obviously if it’s an emergency, yeah. But are students relying on Lyft so much they need a reminder to like, find any other non-$20 way to get to campus?

If so, UF needs to pump more money into RTS"
UF,Yes!!!! r/fuckcars !!!!!!
UF,what’s happening to the hub?
UF,Are the new restrictions just for like parking in that area near the hub to drop people off or are they restricting driving on those roads altogether?
UF,Why does this school increasingly just make life harder for students smh
UF,"It’s Hitch and if  anyone wants to help a homie out and use my referral link because I’m broke here it is :D 

https://www.ridehitch.com/r/CVIhbsJbKJ"
UF,hitch
UF,"I used it for GNV -> JAX the other day and it was pr smooth, similar experience to Uber

It doesn’t let you drop the pin in an exact location tho, so if you’re trying to get picked up from an apartment community call your driver and tell them where you are"
UF,Use whatever one is cheaper and you're good to go. I compare prices on the Google maps tab for ride-sharing
UF,"I always prefer Lyft, it tends to be slightly cheaper, granted I don't use rideshare often. I've never had any issues with either though."
UF,"if you care about political stuff, some people have been boycotting uber due to some scandals in recent years. this is of course a personal decision and does not affect the system whatsoever, but it's something to think about. ([\#deleteuber 2017](https://www.theatlantic.com/business/archive/2017/02/why-deleteuber-and-other-boycotts-matter/517416/), [boycott uber 2019](https://www.cbsnews.com/news/boycott-uber-2019-faces-boycott-threats-after-ceo-calls-jamal-khashoggis-murder-a-mistake/))

i've only had good experiences with uber, been using it for 2 years now. i haven't had to pay more than $8 for rides on uber, but then again i tend to use it on sat & sun mornings when it is less busy.  i can't speak for lyft because i simply can't be bothered to download a second rideshare app lol. but these drivers know they're in a college town and are usually pretty friendly. :)

edit: formatting & links"
UF,"its cheap and convenient.  Surge pricing sucks but i just wait for it to go down.  Like if i wanna go home like 1:30am and surge is crazy, i just hang out with my buds until like 2:30am and then the pricing is normal."
UF,"Free access to LinkedIn learning, all kinds of on-demand short courses, some will give you badging credentials on your LinkedIn profile when you complete them (programming, Adobe suite, excel, marketing, etc.) https://training.it.ufl.edu/linkedin/"
UF,I’m pretty sure at lake Wauburg UF students have free access to rock climbing and other activities
UF,"Free bus rides; free newspaper subscriptions like the NYT; private access to Lake Wauburg with free kayak and canoe rentals; free access to the entire UF library database which includes scholarly journals, historical records both physical and digital, and all types of film; etc. There’s likely more but that’s what I’ve taken advantage of in my time here."
UF,Free condoms and period hygiene products at the Student Healthcare Center.
UF,"I love this topic — here’s my list so far:

• DigitalTheatre+ (stream high quality theatre shows for free)

• The Field & Fork Pantry (free groceries to help reduce food insecurity)

• All of the UF libraries (they have regular books too)

• SG-funded bike shop below Reitz (sooooo underrated)

• The Molm Family Career Closet (borrow professional clothing)

• Free resume printing of up to 20-25 (?) copies on nice paper during Career Fair week

• GatorDays (SG takes students to excusions outside of GNV)

• Marston Tools and Technology Lending ([link](https://marston.uflib.ufl.edu/services/tech-and-tools/) bc everyone should check it out)

• The Marston Makerspace

• The butterfly museum

• Kanapaha garden (not free but at a reduced price)

• Access to Bloomberg Terminal at Lib West (haven’t tried this one)

• HiPerGator (if you’re in need of that kind of computational power)

• [The Meat Processing Center](https://animal.ifas.ufl.edu/facilities/meat-processing-center/) (eat UF-grown proteins)

• The Observatory (open on Fridays for public viewing, weather permitting)"
UF,"I think all students get WSJ, Economist, and NYT for free, business students get a bunch of good financial databases (Refinitiv, CapIQ, IBISWorld, Statista, etc)."
UF,You get Microsoft 365 for free including a TB of one drive space for backup. Makes OneNote the perfect companion.
UF,check out the uf libraries website and you can find a ton! i’ve used it a few times. you may have to go on the uf vpn to get access if you aren’t on campus
UF,"Access to a shit ton of academic journals

Intramural/recsports stuff including free Fitness assessments 

Gator nights

CWC services 

The two museums including butterflies

All uf sports events except football

UfApps has a lot of software for free

Career Center"
UF,I'd like to know this as well! :)
UF,Alot of academic scholar resources for research papers and publications. They usually have a sign in with institutions button
UF,Free Microsoft office on multiple devices
UF,Bloomberg terminals which usually cost 10K I think you can reserve time on. Gives access to all sorts of data.
UF,"$5/month for spotify premium, hulu, and showtime"
UF,New York Times subscription :)
UF,"Don't forget to use your Student ID to get access to GitHub Education, it has great stuff for Tech learning and practice."
UF,You can get a cheap Grammarly Premium account for 3 dollars a month. It requires calling the UF help desk to get them to send you the access key. But it’s definitely worth it for my dyslexic ass
UF,Clear offers all students a four year membership at a heavily discounted price.
UF,50% off lyft ride from 9pm - 3 am most days of the week. U should get an email soon with the link
UF,You get a subscription to the failing New York Times
UF,Discounted car rentals through Avis!
UF,This link should help if you haven’t seen it already [UF discounts](https://benefits.hr.ufl.edu/gatorperks/discount-program/uf-campus-discounts/)
UCLA,"Can you imagine it would be annoying and time consuming to drive through campus? Because if so, that may be the reason. 

The area I drive in has a few colleges and some of the campuses are really annoying and time consuming. Like it may take me 10 minutes to drive through with all the speed bumps and stop signs. That’s -0 minutes I could do 1-2 complete rides instead."
UCLA,Maybe because y’all don’t tip
UCLA,Call a cab
UCLA,I fucking got stuck there while they were doing this stupid ass dorm week or some shit fucking terrible I almost asked the passenger just to walk the rest of the way so I can flip around and get out.
UCLA,Definitely walk off campus. There are several campuses and apartment complexes I won’t pick up from if the passenger isn’t out front. The speed bumps are too much and take way too much time.
UCLA,What's your rating?
UCLA,"Where I am there is only two colleges, one is pretty open and there’s not a huge issue but ones gated and hard to get around so doing ride share is a nightmare. I have more of an. Issue with military bases and people not realizing I can’t pick them up or drop off there (with once exception where I got a contractors badge)."
UCLA,Order Lux I bet they will
UCLA,"Walk off campus into Westwood.  If possible, take a bus for a bit closer to your destination, and then get an Uber/Lyft from there."
UCLA,All this before upfuck pricing.  Those percentages in the study are even further apart now.
UCLA,Full report: https://www.labor.ucla.edu/publication/for-hire-vehicle-data-new-york-city/
