College,Comment
Temple University,"I didn’t bring it first semester and then had it for the last 3.5 years. Never paid for parking. Once you learn the parking patterns and where spots are it’s fairly easy. If it’s a newer car I’d probably leave it home, but I had an older car that I didn’t car if it got bumped or scratched. Was able to do Uber and Lyft to pay my rent too. Being able to drive to good grocery stores and run out to grab things easily instead of having them shipped and stolen off our porch off campus was great."
Temple University,"Matters on who you are. I am from Virginia and only go home during breaks - and since I live in the city 24/7 I walk, bike, SEPTA everywhere with relative ease. If you're someone going home to the suburbs often, or need to get to somewhere not accessible by public transit I would bring your car.

Personally, I think it fun to at least try city life without a car!"
Temple University,"Imo it’s not necessary. Public transportation is part of what makes Temple great. If you need to go to VA or NJ, amtrak is always an option depending on where you need to get to in those states. I’ve heard too many stories of people getting their cars stolen, scratched, dented, etc. I just don’t think it’s worth the risk when you have Septa close by."
Temple University,not needed as freshman. bring it to campus sophomore year
Temple University,If you live on campus or real close to campus you definitely don't need know car everything you need is literally in walking distance or a short bus ride.if you do get a car you definitely gotta worry about car break ins and parking
Temple University,"I’ve had my car on campus for the last two years and imo it’s been very helpful. I live off campus at UV so I use it to go grocery shopping, travel home, and also to take my friends places. It’s also super useful if you can’t get home by bus or train so you don’t have to wait for someone to pick you up."
Temple University,"I spent 13 semesters at temple, 12 of which I lived on or just off campus (the final one I commuted from fishtown only a mile away). I kind of went back and forth with having my car, sometimes it makes sense other times it doesn’t. I’ve always been able to easily get anywhere with septa, so even semesters I *did* have my car I didn’t use it too often. The only time it truly made sense to have it, would’ve been when I lived in an apartment on norris that had no w/d, so I’d have to drive home to the burbs every couple of weeks to do laundry…otherwise it’s kinda a pain because Philly driving can be stressful (and so can finding a spot if you don’t buy garage access). I’d also note that, if you want your car just in case but don’t think you’ll need to drive much (and can afford an extra $400 a semester) I’d say just get a liacouras/Montgomery pass, you won’t have to check on it as much as you would if you leave it on a street somewhere, and you’ll always be guaranteed a spot when you come back if you ever do have to drive somewhere. 

Tl;dr…if you’ll regularly need to get somewhere that’s not near septa, bring the car; if not it might not make sense. Just evaluate your situation and decide based on what seems best."
Temple University,"Dont bring it to campus my guy as alumni. You can literally travel the entire city by subway and train. Ive been living in philly for almost 5 years I have a car now the only time I use it is when I travel to virginia. But I left my car at home because there was no need of it cause I could use subway, trolley, and the line so its very easy to get everywhere"
Temple University,"Even though the pass is 400 a semester, it's totally worth it if it's a new car and you don't want dings, scratches or etc happening. It's useful for grocery shopping, going out, going back home and it served it's purpose for me anyway"
Temple University,Nah. You can get around Philly pretty easily through public transit or with a bike. Fresh grocer is right on campus so you don't have to go far for food either
Temple University,I park my car in the garage and use it to drive to work and to drive home (out of state) on some weekends and school breaks. I’m also a nursing student so I need it for clinicals.
Temple University,It’s only helpful if you pay the $400 semester pass for the parking garage otherwise it’s just stressful having the car on the street.
Temple University,100% great for getting grocery’s and going to see family. I also stay in Philly for the summer so having a car to go on quick beach trips is always useful
Temple University,Very useful. I enjoy taking my charger red-eye hellcat Challenger scat pack and doing donuts on broad every Saturday night
Temple University,"I use mine a lot but that’s because my job is in NJ on the weekends. Unless you’re in my situation or wanting to go home to visit often I don’t think a car is necessary, especially since I’ve had mine vandalized, it’s a risk but for me personally I think it’s worth it."
Temple University,"Had mine from Sophomore year to senior year. Was awesome minus all the parking tickets I got. Being able to drive to grocery store and around the city was really beneficial. Just be aware your car and tires will get dinged up, and don’t leave visible valuables in the car. Other than that I highly suggest it"
Temple University,"i think it’s really useful, you may not need it freshman year though. be prepared for it to get beat up- i’ve had my window smashed, side mirror taken off, and my back bumper has been hit on three separate occasions- taking out the tail light twice. this is all in the course of less than a year. i would chock most of that up to bad luck but also be prepared to walk up to your car with a new ding or scratch every so often. the garage is nice but expensive. there’s lots of free parking and if you end up living off campus certain streets have residential parking passes. they’re like 35 bucks a year for free 24/7 parking. also make sure to always leave your car empty- people will break into it for next to nothing."
Temple University,Sell ur car Get a motorcycle
Temple University,"Depends on what you’re doing frfr. If you plan on going to places far off campus that you can’t access by septa, I’d say bring it. If you’re just going to leave it sitting around, it might not be worth the investment"
Temple University,"Honestly only bring your car if you plan on driving back home often or if you like to explore places outside of the city on the weekend. I have my car here and I use it a couple times a month but that’s only when I’m being lazy or want to leave the city. Also parking on the streets is free depending on the street but sometimes it’s frustrating trying to find a spot close to wherever you are living. 

If you do decide to bring it remember to keep the inside clean at all times and never leave anything out that could catch someone’s attention to steal. Having your car here gives you one more thing to be anxious about. I would only bring it if you really think you’re gonna use it."
Temple University,i bring my car cuz i work but if you aren't working and just staying on campus you probably won't need it
Temple University,It's good for getting stolen
Temple University,"Everyone’s case is different but in my case, my house is close enough to campus where I can just leave the car home and not worry about parking or having it broken into, but also be able to use it if needed. I did have the car on campus for a moment in time until it got towed and broken into the same week (luckily not stolen). It depends where you want/need to go. If you’re staying within Philly or traveling between other major cities, you have public transit and Amtrak. If you’re going outside the cities or to heavily car centric areas, it helps significantly."
Temple University,"If you’re commenting to campus sure but if you’re on campus I don’t really see the point. Amtrak takes you pretty far and there’s also greyhound busses for spots that amtrak doesn’t hit. Regional rail, subway, busses and uber are also an option for areas near/ just outside of the city. I’d say skip it freshman year and if you find yourself really needing it bring it next year"
Temple University,It was nice having my car on campus for 2 years to drive to grocery stores/different areas of Philly/out of the city. I wouldn't recommend as a freshman.
Temple University,"No. Subway on one side and regional septa train on the other side. Anywhere you would want to go on campus is within a 10 minute walk usually, anywhere you'd want to go in the city is significantly faster via public transportation, and the subway fee is only like 2 bucks for any distance. Not worth the crazy expensive parking fees to have a car around. If your parent's home is within range of an Amtrak station, 30th St station is also accessible with just the subway, and the stop is literally right across the street from the train"
Temple University,"brother i did not get my license until after graduating, no car is extremely viable in the city, especially if you're fairly local to begin with."
Temple University,"After your first year, bring your wheels you’ll make your life much easier"
Temple University,"come if u think philly and temple is a good fit for you, lifestyle activities vibe yk.. like i feel pretty safe but its def like a you never know whay happens so just stay smart but u cant control anything situation"
Temple University,Can we get a tracker for every time this question (or something along these lines) is asked?
Temple University,ur gonna die multiple times
Temple University,yes ghouls and goblins roam the steets
Temple University,"I mean seeing how I lived on Cecil my first year off campus and my apartment got shot in to (I lived on the top floor-4 stories) I don’t think temple/north Philly is very safe. 

Then the next year, my car got broken into on 17th and on one occasion my roommate and I walked outside as someone drew a gun and began shooting at someone across the street.. would never recommend or go back to school at temple"
Temple University,"As long as you don’t walk around at like 2 am on the outskirts of campus and/or befriend student drug dealers, you should be fine. I never had a problem, but definitely know people who did and they almost exclusively fell into the previous categories. Things in Philly should also improve drastically after the mayoral and council elections that are upcoming in 2023, so safety should improve overall."
Temple University,Tbh I live very off campus and never feel like temple is very unsafe. Sometimes it’s bad but that’s usually far off campus. If you’re in the dorms you’re good. I’m not  in honors but I think u can only live in honor dorms ur first year.
Temple University,Ever heard of the search function?
Temple University,"if you are smart and travel in groups you will prolly b okay. just don’t be dumb, and be aware of your surroundings."
Temple University,"my opinion is not valid since I’m a commuter. I live off campus all the way in south Philly, and I’m on campus from 8am to 5pm, there is a few alerts but it’s honestly not that bad. You’ll be fine, just don’t wander around too much unless you really need too (like to go shop)"
Temple University,"I had a few people get shot and killed on my block this semester, so I wouldn’t say I personally feel safe. Although there are plenty of places that are safe to live around campus and especially *ON* campus. Not trying to scare you, but it seems the people in this comment section have had a very different experience than me so I wanted to add my two cents.

Edit: poorly worded. A few people were shot and two people were killed in 3 or 4 separate incidents."
Temple University,Yes.
Temple University,"Congratulations on your acceptance into Temple and the Honors program! Def try for the Honors LLC for living on campus all 4 years - many students will choose this option. As for safety, Temple does take a proactive stance on keeping students safe. And yes, you should be aware that studying and living in a major city like Philly has its upsides, and downsides - crime being one of them. I would visit the campus when you can to experience it for yourself, and also take a look at how Temple keeps our students safe - https://www.temple.edu/life-at-temple/safety"
Temple University,Anyplace is unsafe if you’re not smart and put yourself in a bad position. My four years there were some of the best of my life.
Temple University,"Live at the Kardon. It’s cheap, spacious, and on the opposite side of campus where most of the crime happens. I have never felt unsafe on this side of the campus. When I cross over I do not feel safe whatsoever and I’m amazed students live there."
Temple University,"It’s not great, but doable."
Temple University,Safe
Temple University,"uhhh depends, there’s been house break ins recently and my car got broken into. you just have to be smart like everyone else says. this isn’t like a suburban area where you can roam around care free. i say during the day you’re safe but at night is when i’d be careful"
Temple University,"If you're on campus you'll be fine. Occasionally there's a freak incident that effects those loving in the dorms but for the most part you'll be fine. Off campus is a different story, especially the further away you are. 1300 is great, try to get a room facing the courtyard in case of stray bullets."
Temple University,"Yes it’s dangerous, i live on campus only because I don’t want to be killed walking around at night and I don’t want my apartment to be broken into."
Temple University,"Ur good, don’t rent too far off campus and u should be fine."
Temple University,yes
Temple University,"I’ve lived in the “worst” areas like susquehanna/dauphin all 4 years and nothing happened to me or my friends, besides maybe a car window getting broken into when a friend left her (empty) wallet inside. Standard city things, if you have any exposure to poverty or urban life you’ll be fine but if not I guess it can be scary"
Temple University,"As someone that had the same concerns when I was deciding on colleges, I ended up being fine.  Even after going out almost every weekend.  Just handle your liquor well and beware of your surroundngs.  Remember that a $20 uber can be a lot but can save your life.  Temple offers “flight” which is a free bus that takes you anywhere on/off campus.  I used it a lot to be dropped off at frats sometimes, even to avoid cold walks!"
Temple University,Yes
Temple University,You’ll be fine. I’ve never felt unsafe because I don’t put myself into unsafe situations. Take that information as you will
Temple University,We’re all just cats. We got nine lives and luckily I’ve only used up 3 at Temple so far
Temple University,"Compared to what you're likely used to, no it's not safe. That's not to say you'll constantly be in danger either.

I lived off campus for 3 years and had little to no trouble (my catalytic converter and bike got stolen, but I was basically asking for it each time 🤪). Being safe mostly comes down to basic street smarts & situational awareness. 

This is the perspective of a 6'2 male though, so I can't speak for everyone."
Temple University,"As a alumni commuter I can say the Temple campus is safe, along with the dorms that are set up within the campus. However, the best way to look at it, the further you go North from campus, you'll be in an area you shouldn't be if you're alone (imo even the Hospital campus). However, the further you go South, the closer to the city so you won't be in a shady area, but you'll still encounter weirdos. I would visit the area first and try to do a Campus tour if you haven't done so yet because each persons experience will vary based on what they're looking for."
Temple University,"I feel like if you’re asking these kind of questions already, you know what’s up lol. Temple safety is ok. If you get offered a decent deal, and none of the better schools take you: I would go. If safety is a priority for you I would recommend staying at one of the apartment complexes directly on Temple’s campus. The surrounding area is sketch and the locals know who’s a student and who’s not  - so avoid late nights."
Temple University,"im a freshman in the honors dorms this year. i thought i’d stay in the honors dorm for most of college, but realistically most people move into apartments after freshman year. so you’ll probably end up doing the same if you want to stick with your friends. if you’re worried about safety the view or vantage is a good in-between option for if you want an apartment that is technically on campus but not considered a dorm as you enter later years."
Temple University,"I feel relatively safe, but I definitely think as long as you stay close to campus if you’re planning to live off-campus or in the honors dorm on-campus you should be fine. The advice I got my first year was from other girls at my work and that was to get Citizens, because it gives you extra piece of mind, on top of the escort services Temple already provides if you don’t feel safe or are out late at night. The advice of just knowing where you are is important and don’t take any classes super late unless they’re online and necessary. The end of the day, it’s something to think about and mull over for yourself personally."
Temple University,You make less money because it’s their car. Shit is really not worth it… if I’m not mistaken you don’t make money until you pay the rental first high is deducted
Temple University,"Im a flexdrive renter and yes they do lower your rate. You can make money. My weekly rental is $210, that includes insurance. Yes my rate is lower but i get to use a car for personal trips, i can return it whenever, im not destroying my own property. If I drive seven days a week, i only have to earn $30/day to make rent"
Temple University,Yes you make less make cus the cars gonna run you 1000$ a month at cheapest plan but also the rate card is lower so you’ll also get paid less per ride compared to other Lyft drivers
Temple University,"Im trying this out and will report back, need some sort of second job before I lock in a second restaurant job. 

But just some simple math here

Either way, there are way better ways to make money in this world. This is only something that should be done in emergencies (which I am in at the moment), and Lyft knows that hence the horrid pay.  Then, 600x.80 = $480 to account for taxes (Need to set aside 20% to be smart.  That means if I work about 30 hours/week Ill net $150/week. Thats $600/month I didn't have in my pocket before. Then divide 600 by total hours per month and you get 5. So to rent a vehicle from Lyft, you make about $5/hour after taxes and fees. If you want to do all those same calculations with a car you're making payments on its probably a little bit better but harder to factor in cost of maintenance and more upfront costs. And if you own the car and want to run it into the ground, I guess this is the best scenario but just know you pay for everything either now or later, that's the way the world works.

Either way there are way better ways to make money in this world. This is only something that should be done in emergencies (which I am in at the moment), and Lyft knows that hence the horrid pay."
Temple University,"Don't believe these people on here. I have been renting with lyft for 7 months. I make between $1700 and $2100 a week. My rental costs $251 a week. It is deducted from my account on Mondays starting at 5am. So the first $251 I make goes to lyft. But I leave the app online and also do Empower, or uber. So I'm still able to cash out something on Mondays. I have a Honda Insight 2021. Get 60 MPG costs $20 to fill up every 2 days. Drive about 400 miles a day. Put over 35000 miles on this car in 7 months. Do you really want to do that to your personal car????? I pay about $1000 a month. It covers rental, insurance, all oil changes, pm, all repairs are done at my house or the Hub. Free of charge with a free loaner. I add $30 per week and have zero deductible for accidents. I can run this car I to the ground. And when it bottoms out. I just swap it out for another one."
Temple University,"It’s a very , very bad idea. Find another way to get a car."
Temple University,It depends on your market.
Temple University,It used to be 45 against 60 cents per mile difference
Temple University,"My market is Washington DC, Virginia and Maryland"
Temple University,Don’t do it it’s 1600 a month just in rental
Temple University,It feels like it’s a combination of traffic and a lot of drivers having legitimately no idea how to navigate their way to the pickup point. I’ve ran into this a lot.
Temple University,It's a pain in the ass. And the gps is pretty rough so it often shows them on the wrong road
Temple University,Cabs are flat rate out of there and way faster usually. Cost is comparable.
Temple University,"I call Uber/lift once I get to baggage area and often find the driver spending like 5-10 min just stationary in a lot not far away after accepting. Once they start moving, seems to take another 5-10 min going that long way round (which is normal path I get it) but the last stretch always crawls weird slow, I too am curious if it’s just a gps issue or if there’s checkpoints? Overall 10-20 min waiting for a car is reasonable but I too wonder if there’s reasons they show stationary on app so long so often. "
Temple University,"Ive had several experiences where they message me asking where i am, and they are parked like a full mile away"
Temple University,I feel like they've always passed some pivotal turn right after accepting my ride
Temple University,They moved the driver waiting area and now you have to circle around the entire airport to get to the pickup spot
Temple University,"Frequent business traveler here. If I just missed an airport train, I walk over to the taxi stand and just jump in a cab & go."
Temple University,"this is why i always take a yellow cab from the airport. there's never a wait, and the price is similar, sometimes better"
Temple University,How can you know ahead how much the taxi will cost? I worry about getting in and a driver trying to negotiate as I’m in the cab.
Temple University,"I have to pick up my wife from the airport frequently and no one knows how or where to drive down there. That’s gotta be the leading cause. I’m there more frequently than the average person so of course I’m more familiar with nav’ing PHL than randos picking someone up for the first time, but the rideshare drivers are just as bad as the rest of them."
Temple University,"I've used lyft here twice. I went to the dedicated lyft pick up for the first one but they ended up asking me to fucking walk back to departures area. the second one was the other way around despite pinning the departures area. the second time I used it, I saw the driver circle the airport twice. I don't think they know where they're supposed to be or how to get there."
Temple University,"This used to happen to me all the time so I just started taking cabs. I don’t know if this is true, but I read somewhere that some Uber drivers stall hoping you’ll cancel if you’re only going a short distance."
Temple University,"What LAX did for Uber/Lyft pick up is so much better than a lot of airports, wish more would do the same."
Temple University,I miss the taxi stand actually having taxis.
Temple University,"Are you at the correct pickup point?  It switched a year or two back. .If the drivers are saying they don't see you, its probably because you walked out under the overpass area, where peoples family pick them up.  Uber/Lyft is behing there, on a different road."
Temple University,"Did you actually get charged for it on your Wells Fargo statement or is that just a 20$ line item in your Bilt Rewards transactions. I see the line item on the Bilt app, but it's not a charge I have to pay on my actual credit card statement from Wells Fargo."
Temple University,I also have the $20 Lyft Pass transaction 1 day after the my Lyft ride where I used the promotional pass. Really hope it doesn't show up on my statement.
Temple University,"Yeah it’s definitely a give and take. I’m not a driver, I typically use Lyft because it is cheaper."
Temple University,I'm in the philly market area as well but i find lyft a lil better. They are averaging bout 1.30 to 1.40 per mile.As far as uber they aren't as busy. By the way down in delaware. Maybe thats the difference.
Temple University,"Yeah. I’m in the Philly market. The only reason I do Lyft occasionally is because their destination mode actually works. Uber’s is terrible. If I don’t have to be somewhere, I always use Uber."
Temple University,">Can one earn enough driving solely for Lyft in, say, 30 hours to cover the rental+expenses should rental rewards not be achieved? 

Maybe, but do you want to drive 30 hours just to pay for the rental?

Rental is only useful if you drive enough to cover the cost, which is unlikely with the hours and days you have available.



"
