College,Comment
Auburn,"I don't agree with the Opelika people. If you want a quieter hipster-y place, then sure. But Opelika is further from the school, and drive time matters. If you're buying a house, I'd think twice about Opelika--it's way cheaper there because fewer people want to live there. House resale value is way better in auburn because auburn schools are some of the best in the state. If you switch jobs or don't get tenure or whatever, you'll want to sell your house quickly, and auburn guarantees that will happen. 

It's not like you can't still drive to downtown Opelika. 

I've lived here for 3 years now. 

Auburn has better parks as well. It seems to me the people suggesting Opelika in this thread are just saying the downtown life is better for you there, which is probably true, but since when is that the main criteria for where to live? Live close to where you work. 

Finally Auburn has zoning rules that mean some neighborhood are single family only, which means no student rentals. Live in one of those areas or be sad. Most the property management companies have listings divided as student or non- for this reason"
Auburn,"Love this area honestly. It has a lot to it if you know what you're looking for. I'm a huge foodie so there's tons of great Korean, sushi, bbq, soul food, Italian and other places to eat. Depending your style, you can do downtown Auburn bars which are crazy busy with the loud music send dancing and whole 9 yards. Opelika is more chill of a bar scene if that's your thing. There's also the Nerd Torch Cafe in Opelika that has a ton of gaming stuff, ax throwing in Auburn, indoor gun range at the firing pin, pinball in Opelika, and a host of fun live music each week at various bars. And Birmingham and Atlanta are just a 2 hr drive each if you miss the city life"
Auburn,"Coming from SoCal may be a bit of a culture shock. Auburn is a very southern and mostly conservative school. That being said I know and have friends from SoCal that love it, it’s really a personal thing so if you can visit and spend a weekend here I would recommend it.

As stated Auburn is a hard school for being a state school. Think it’s been ranked 5th hardest school to get an A at for the past few years. Once again take that with a grain of salt, but I definitely see it from my classes here. However that doesn’t mean you’ll be studying all the time either, just makes you “grow up” and realize how you learn faster.

Diversity can also be an issue. If this is something you want to take further auburn DM me and I can go into more detail.

Also since you are OOS. Auburn is a great, well known school here, but if you plan on going back home it will have little name recognition. 9/10 people I talked to when I worked in NYC had never heard of it, and if they had it was because of Football.

Generally OOS will get dorm rooms in the Hill. It’s not the best dorms in the world, but everyone I know ended up saying they weren’t as bad as they thought going into it. You may also get some of the nicer ones, but it’s kinda a lottery. 2 girls I dated were both OOS and lived in the Hill and still have some of their best friends from living there. Auburn also doesn’t require you to live in a dorm freshman year, so you can always get an apartment.

There are other small thing, but most of them I would consider a personal con that may be a pro for most people. Overall there isn’t a lot at Auburn I would consider a “con”. I had a choice of about 20 school and still ended up coming here and I have loved every minute of it.

My word of advice is to come spend some time here and get to know it. And I don’t mean Camp War Eagle either. Feel free to ask anything, I’d love to help.


*Edit* 
Read through some of your other comments, looks like you are interested in Greek life.
“Luckily” you are a girl so you won’t have to deal with flying here for summer rush events, just the week long beast that is girl’s rush. From what I know Greek life will be different from what it is in SoCal. Not crazy different, just scaled up and more intense. Average sorority pledge class is around 90 and something like 15 social sororities. Can’t help you to much though with sorority stuff since it is a lot different from fraternity stuff."
Auburn,"Shit parking on most of campus, downtown parking is getting worse, explosive population expansion, and a lot of construction. 

To counter the first two, it’s not wildly expensive to live close enough to walk to class within about 30 minutes and the bus is *typically* pretty good for the father apartment complexes, Uber and Lyft are usually $8-$16 downtown if you live remotely near campus."
Auburn,"NorCal Auburn Student here. Honestly, there haven’t been too many major cons, as most of the issues are common to colleges everywhere, like foreign TA’s teaching calculus with illegible handwriting. Parking can be a bitch, but I got an apartment close enough to campus to walk to class every day, and the school-run shuttle program is pretty solid and even does weekly “Friday shopping” routes to get you to grocery stores. It might not be super pleasant to live without a car, but it’s a lot better than dealing with the hassle of parking passes.

Classes are pretty straightforward to sign up for, but be sure to badger the hell out of your advisor to make sure you’re on the right path. Decided to take a choose-your-own-Adventure outlook on my engineering schedule and hooo boy, that almost screwed me hard.

I’ll edit my comment if I think of any more pressing ones.

Edit: minor inconvenience, but you have to pay for bike storage on campus, the community bikeshare has sorta gone to shit, and the campus is big. Leave extra time between classes you know will be far away from each other, especially early on when you need to jump back and forth between classes in your major (wherever those are) and general req classes that will most likely be in Parker or SCC. Don’t want to be running in the nasty high-humidity heat that lingers on either end of summer break."
Auburn,You don’t want the pros?
Auburn,"My roommate junior and senior year was from California. We were in the same pledge class and became good friends during sorority stuff.

She was familiar with southern culture because both her parents went to school in Texas so I don't think she was really shocked by it at all. She got along fine with girls here, so I don't think you'll have any trouble making friends.

The one thing she always hated was not having a car, I had to drive her everywhere, which was fine for the most part. There are shuttles to Atlanta airport so it's not like you can't get outta town when needed.

I would assume things like rent and food etc are way cheaper in Alabama, then what you're looking at in California, my rent while I was in school was $500 a month which included cable and internet and I was a block from campus, but you more than make up for it with oos tuition.

I think you should make your choice based on your education goals tho. Auburn is an amazing school, if you find yourself there, and you take advantage of all it has to offer, you won't be disappointed."
Auburn,"I just finished freshmen year, so I'm definitely not an expert, but I will say one thing that may differ from other colleges is that there isn't much going on at night on campus. I lived on campus without a car and found myself really bored in nights that I didn't have much homework. This is mainly because the majority of students live off campus in apartments, so once classes end campus dies down quickly."
Auburn,"There's not really anything in town aside from the school. There's no bookstore if you're looking for something beside textbooks (there's a Books-A-Million in Opelika, but I've never found anything interesting there); there's not really a music scene. I love Auburn, I made some good friends in my time here, I think I got a great education, but if I'd known that it was a borderline culture void, I would have strongly considered other schools"
Auburn,"The town is really dead outside of the University. This not only affects ""stuff to do"", but also the health of the townspeople outside of the University.

Unless you want to come to Auburn for the education, I wouldn't. There are better places to be. That said, everywhere has problems, and Auburn is far from the worst. It's relatively safe, good climate, the college provides a nice bubble with tons of cool/interesting people."
Auburn,"i graduated this may. no matter how bad you want to get away from home right now, it's going to suck big time for a while being so far away. all of my friends were driving distance from their families and went home almost every weekend and so i was alone a lot, especially freshman year because i came knowing no one and struggled really hard adjusting and making friends. unless you have the money to fly or friends you could go home with, things like fall break or easter weekend will be pretty lonely. 

i would not say it is a diverse school and as others have mentioned campus can be very conservative, so if that's important to you it's good to be aware of. it's something i wanted when i applied and ended up disliking by the time i graduated.

alabama in general doesn't have the greatest medical care and if you have a uterus i'm sure you heard it isn't the, uh, friendliest? right now, so again, if that's important to you, you should be aware.

&#x200B;

of course i am obligated to say it is a wonderful, beautiful school filled with a lot of incredible people. but you probably know that already!"
Auburn,Definitely the shuttle
Auburn,Your looking at a 30+ mile Uber even if they were out there.
Auburn,Anybody know where the shuttle pickup location is?
Auburn,Where can you park for the shuttle service? I have heard it is drop off only at shuttle?
Auburn,"Could see if there are any restaurant jobs available for night or weekend shifts. Or gig work like uber, doordash, etc. if you want to set your own hours"
Auburn,My youngest drove for Lyft and was able to set his own hours. It might work for you.
Auburn,"DoorDash but just don’t be their btch, be selective."
George Washington,"SEAS DLC :)

Those are additional free resources specifically available for the superior SEAS students. A lot of them will require you to request the access by email and/or be on GW network (GW Wireless or GW VPN). So to spare you from adding ‘\*’ and '^(1') after each one, check this link ([https://www.seas.gwu.edu/software-licenses](https://www.seas.gwu.edu/software-licenses)) to check :)

Note: some softwares don’t have a special webpage for how to download them, so you’ll have to refer to this link to know how.

&#x200B;

Since there are too many softwares to list in plain text, I decided to divide them into the best subsections I had in mind:

&#x200B;

&#x200B;

* The ones I used before:

[Solid Edge](https://www.seas.gwu.edu/solid-edge) CAD

[SolidWorks](https://www.seas.gwu.edu/solidworks-student-license) A brother from a different mother for Solid Edge.

[ANSYS](https://www.seas.gwu.edu/ansys) Engineering simulations & 3D design. Really good, and really powerful.

[Multisim](https://www.seas.gwu.edu/multisim) A circuit simulator, I think all ECE majors have to use it starting sophomore year. Really helpful to test your circuit to prevent blowing up your actual circuit (which still happened in my case)

[AutoDesk](https://www.seas.gwu.edu/autodesk) All the AutoDesk software you could dream of. To name a few: AutoCAD (with all of its different versions), 3ds Max (although I still prefer blender), Revit, and others that I’ve never heard before.

&#x200B;

&#x200B;

* The ones I heard about before, and wanted to try (but haven’t yet):

[Azure Dev tools](https://www.seas.gwu.edu/microsoft-azure) This could be huge. I mean like, huge huge. The only problem is I don’t actually know what is it. But as soon as I do, I’ll update this comment.

[Oracle academy](https://seascf.seas.gwu.edu/oracle-academy-subscription) It seems like a computer science educational resources (MySQL, Java, Solaris OS, etc.) provided by Oracle.

[VMWare](https://www.seas.gwu.edu/vmware) Most of VMWare’s software are available for us, including their virtual machine.

[Wolfram Mathematica](https://www.seas.gwu.edu/wolfram-mathematica) In simple words, it’s a powerful calculator.

[LabVIEW](https://www.seas.gwu.edu/labview) LabVIEW is commonly used for data acquisition, instrument control, and industrial automation <<< I took this from Wikipedia because I heard it’s a really great software and many researches use it, so I felt it deserved a better summary than what I’d come up with.

&#x200B;

&#x200B;

* The ones I never heard about before, but got a slight interest in them while making this list:

[Qualtrics](https://www.seas.gwu.edu/qualtrics) A tool to analyze online surveys.

[Tecplot](https://www.seas.gwu.edu/tecplot) CFD (Computational Fluid Dynamics) Visualization & Analysis Tools

[ArcGIS](https://www.seas.gwu.edu/arcgis) A geographic information system for working with maps and geography (what is this thing doing in SEAS?)

\[Altair Hyperworks:[https://www.seas.gwu.edu/altair-hyperworks](https://www.seas.gwu.edu/altair-hyperworks)\] A complete CAE (computer-aided engineering) software

CoventorWare: For designing MEMS (Microelectromechanical systems, not memes)

MathType: apparently it’s an add-on for word/pages and powerpoint/keynote for writing Mathematical notations??!

MINEQL+: A tool for performing, visualizing, and managing chemical equilibrium calculations.

OPNET: Network simulator

&#x200B;

&#x200B;

* The ones I still have no idea what are they actually even after searching for them to make the list (this list was also too long, so it has been sub-sub-divided):

\-   Cool names:

[Abaqus](https://www.seas.gwu.edu/abaqus) Finite element analysis and computer-aided engineering (CAE)

[Simio](https://www.seas.gwu.edu/simio) Intelligent object-based simulation

[Xilinx Vivado](https://www.seas.gwu.edu/xlinix-vivado) synthesis and analysis of HDL (hardware description language) designs

Cadence: designing integrated circuits, systems on chips (SoCs) and printed circuit boards.

QUARC: It generates real-time code directly from Simulink-designed controllers and runs it in real-time on the Windows target – all without digital signal processing or without writing a single line of code. (personally I liked the underlined part. I still don’t know what it does though :)

Silvaco: electronic design automation (EDA) and technology CAD (TCAD) software and semiconductor design IP (SIP)

Synopsis: silicon design and verification, silicon intellectual property and software security and quality.

SAP2000: Analysis engine and design tools for engineers working on transportation, industrial, public works, sports, and other facilities.

&#x200B;

\-   half decent names:

[Advanced Design System (ADS)](https://www.seas.gwu.edu/ads-agilent-technologies) An integrated design environment to designers of RF (radio frequency) electronic products

[Minitab](https://www.seas.gwu.edu/minitab) To quote SEAS: “Minitab provides convenient features that streamline your workflow, a comprehensive set of statistics for exploring your data, and graphs for communicating your success.”

AGI STK: A platform for analyzing and visualizing complex systems in the context of your mission. Interact with data from platforms across the aerospace, defense, telecommunications, and other industries. Simulate your intended missions and communicate the results with reports, graphs, and stunning 3D animations.

Comsol CKL: Multiphysics simulation

ENSOFT: It appears to be a company which has multiple softwares. I don’t know if we can get specific one/ones, or all of them. Neither do I know what any of them does.

Palisades DecisionTools Suite: Risk managing and decision making.

Pro-Engineer (now called PTC Creo): Integrated 3D CAD/CAM/CAE software

StructurePoint: Multi-purpose structural modeling and finite element analysis software for two- and three-dimensional buildings and structures."
George Washington,"2nd DLC for CCAS:

Apparently GW thinks CCAS also needs some special software resources. Which is weird because everyone knows only SEAS deserve such a treatment /s

&#x200B;

[AutoDesk](https://ots.columbian.gwu.edu/autodesk) All the AutoDesk software you could dream of. To name a few: AutoCAD (with all of its different versions), 3ds Max (although I still prefer blender), Revit, and others that I’ve never heard before.

[Qualtrics](https://ots.columbian.gwu.edu/qualtrics) A software to analyze online surveys.^(1)

[Wolfram Mathematica](https://ots.columbian.gwu.edu/wolfram-mathematica) In simple words, it’s a powerful calculator.^(1)

&#x200B;

This is the link for all the remaining ones I’ll mention: [https://ots.columbian.gwu.edu/virtual-applications-citrix-xenapp](https://ots.columbian.gwu.edu/virtual-applications-citrix-xenapp)

Keep in mind that as a non-CCAS student I couldn’t access them, so you’re by yourself from now on.

&#x200B;

ESRI ArcGIS: A geographic information system for working with maps and geography.

Atlas.ti: Used for qualitative analysis of large bodies of textual, graphical, audio and video data.

ERDAS Imagine: Geospatial data authoring system.

GAUSS: matrix programming language for mathematics and statistics (similar to MATLAB, I think)

Stata MP-4: statistical software for data science"
George Washington,"Thanks for compiling!!! That capital bikeshare is quite a discount, I can't believe they don't advertise this to students more."
George Washington,"Just an FYI some of the things listed are for employees only such as ibuy, efax or jabber and are not available to students unless they work for the university and even then its dependent on your role/position. Also you have the wrong link for VMware. It should be: https://www.seas.gwu.edu/vmware. 

ArcGIS is used by civil engineers to track traffic/movement patterns and is also useful for environmental engineers to create hydrology maps etc. Azure Dev Tools is for Microsoft software so you can get things like Windows 10 Education Edition or Microsoft Project (which is not included in 365). There’s also the ability to build VMs using Azure online. Also, Autodesk is free for all students enrolled in university/college, you just have to create a student account and they verify enrollment."
George Washington,They added a stop after making the pickup/dropoff at the airport lmao... Lyft didn't update the price (means it is so horrible they don't want to show you)
George Washington,This had to be a mistake. There is no way.
George Washington,WTF!
George Washington,More and more people are adding stops after we are ALREADY driving for a couple minutes…it updates to 10 cents more. I wonder if this is new “hack” with passengers cuz I never had this happen before as much as recently.
George Washington,You drew a penis.
George Washington,And a stop. Lucky you
George Washington,Ain’t no way
George Washington,Come on that can’t be real. Maybe missing a zero? That is nauseating.
George Washington,"How is this even possible? This should be illegal, in Washington State this shouldn't happen because of legislation passed. That's slave pay."
George Washington,Lol kick em out at the first stop. This is on you.
George Washington,It just gets worst 😭
George Washington,You owe lyft after gas for doing this
George Washington,Some top dawg took it
George Washington,Sucks that company feel sorry for all new guys
George Washington,someone still took it
George Washington,"Yah really love attention from reddit users….

We’ve seen these screenshots 100000 times why do you people continue spamming  this stupid shit."
George Washington,"Madison hall is probably the best freshman can do in terms of location, if you have classes that aren’t in Elliot it’s a bit of a walk for thurston to get to like the side of campus with more of the lecture halls like Rome/phillips or Tompkins. West hall is probably the best hall freshman have access to since you would have a private bedroom and a common space as well as everything else west has access to: gym, dining hall (tho pelham isn’t that good), black box theater, etc. only problem is it’s on the vern which is honestly not that bad besides the vex being awful to deal with"
George Washington,"Potomac -1, Guthridge -2, madison -3, Lafayette -4, Thurston -5, Mitchell -6 and all Vern last.
I’ve seen the plans for the Guthridge renovation and it should be very nice and is transferring to a freshman dorm. Thurston is only so low due to communal restrooms and small bedrooms so if that doesn’t bother you then it could move up."
George Washington,Potomac is quiet and has large and new rooms. It’s great because you don’t have communal bathrooms but you’ll most likely have to share with another double. If you get Potomac definitely become acquittances with your suitemates it will help a lot!! You’ll lose the social aspect of Thurston because you won’t really know the people on your floor but I highly recommend as a freshman dorm.
George Washington,https://drive.google.com/file/d/19YjUVM5hB3A84r4U1epG-E6Tobrlbmfe/view?usp=drivesdk
George Washington,Vex is abysmal so dont go for the vern 👍🏻
George Washington,"1. potomac: own bathroom, decent size room and storage space
2. madison: good location but kinda old
3. thurston: new, very social, but small rooms and no private bath
4. district: big rooms 
5. LaFayette: big rooms 
6. guthridge
7. jj
8. mitchell
9. west hall (vern)
10. somers (vern)
11. all other vern dorms"
George Washington,big chance you will be put on the vern. but as a rising senior im telling you that GWU is going downhill. the housing process is a mess. you will be better off committing to another school. save your money and your mental health.
George Washington,"It’s truly a good community. I was never on the vern but I always hear amazing stories of how the connections made are fruitful and quality. I know many that were happy about it and also GW tries as hard as they can to promote the vern so there are tons of events with free food and activities. Also, ngl the nighttime free Lyfts back to the vern is kinda a flex. 

It’s the best way to have a proper college experience with a big outdoor campus and all the amenities you need."
George Washington,"I always say that the Vern itself is really nice, it’s the commute that’s annoying. 

The Vern has that more traditional campus feel, and it’s much quieter and more peaceful, so I think it’s a more chill environment, which I really liked as a freshman. I think it’s also easier to make friends on the Vern in comparison to Figgy Bottom, because you see the same faces a lot more (although I personally made my friends through students orgs, but that’s more because I was really shy as a freshman). I also think the dining hall on the Vern is the best dining hall on campus in terms of quality, and I think it’s because they have to cater to fewer students, so the quality is better (although the foggy bottom dining halls are improving). 

Overall, I really enjoyed living on the Vern, and I liked the fact that it was much quieter and more peaceful. I think the commute is annoying, but the Vern itself I think is really nice"
George Washington,The West Hall gym is usually empty. They have pianos and practice rooms as well.
George Washington,"I think the campus is more peaceful, soccer field, honestly id wanna live in the Vern if not for its location"
George Washington,"You might not stay friends with the people you meet on the vern freshman year, but you will immediately and forever click with anyone who lived on the vern at some point. Alum, upperclassmen, whoever. You can use the vex as an excuse for being late as it is, in fact, ALWAYS running late. It’s a quiet campus if you are into that (I wasn’t, but midterms and finals hit you really hard, and it’s nice to come home and force yourself to be… home). If you live in west, that building is pretty good (facilities are super accessible). If you don’t, you get to dunk on the west hall kids who do kinda have it better (west hall best hall but like it IS an unfair deal if you’re on the hillsides). Lyfts are helpful… to an extent. You can be your buddies lyft pass as well, so its way easier to have late night hang outs now than it used to be. Otherwise make of it what you will. There’s a lot of downsides but you find what you love about it in your time. And then coming to campus is even better (plus you know how to budget better)."
George Washington,The campus itself is better in basically every way. It’s just that its location sucks and you have to Vex over to Foggy to do anything.
George Washington,"The nice thing about it is basically a complete lack of adults in the room if you’re into that, I never ran into a CC or anything like that"
George Washington,buff and brew
George Washington,You get to play Escape the Vern! Nothing like Type B fun for bonding
George Washington,"The Vern campus wise is very nice. It’s near some restaurants and a small town, which sometimes has flea markets. Also I’ve known some individuals who were able to get pet sitting, dog walking and babysitting jobs in the past. 
However, in my opinion the best part of the Vern is the Lyft pass. After midnight you can get a Lyft back to the Vern if you are out (which is really nice as you get to skip the hassle of getting back to your dorm) and on Saturday there is a pass to get to the shoppers which is lovely as it makes it easy to get groceries back!"
George Washington,I used to go to the Vern on the weekends just to sit in the library there
George Washington,Buff
